{
  "manifest_version": "1.0",
  "vehicle_id": "veh-pseudo-burn-all-001",
  "session_id": "d4735e3a-265e-4f18-b2c1-3a1f68e49bf6",
  "session_start": "2026-04-08T12:00:00Z",
  "stakeholders": [],
  "mandatory_retention": [
    {
      "type": "ecall",
      "regulation": "EU_2015_758",
      "treatment": "exempt_outside_boundary"
    },
    {
      "type": "edr",
      "regulation": "EU_General_Safety",
      "treatment": "exempt_write_once_partition"
    },
    {
      "type": "security_event_log",
      "regulation": "R155",
      "treatment": "declared_mandatory"
    }
  ]
}
